id,title,author,subreddit,score,upvote_ratio,num_comments,created_utc,created_date,url,permalink,selftext,link_flair_text,is_self,domain
1qrab59,"Olympic bus fare surcharge leaves 11-year-old stranded in snow | An 11-year-old schoolboy who did not have money for a bus fare surcharge introduced for the Milano Cortina Winter Olympics was forced to walk 6 kilometres (3.8 miles) home in sub-zero snowy weather, his family said on Friday",Socmel_,europe,8532,0.97,412,1769790743.0,2026-01-30 16:32:23,https://www.reuters.com/world/olympic-bus-fare-surcharge-leaves-11-year-old-stranded-snow-2026-01-30/,https://www.reddit.com/r/europe/comments/1qrab59/olympic_bus_fare_surcharge_leaves_11yearold/,,News,False,reuters.com
1qaovdk,"Cloudflare’s CEO has threatened to pull the company out of Italy, and to withdraw free services it intends to provide to the Winter Olympic games",Logical_Welder3467,technology,6656,0.97,562,1768203915.0,2026-01-12 07:45:15,https://www.theregister.com/2026/01/12/cloudflare_vs_italy/,https://www.reddit.com/r/technology/comments/1qaovdk/cloudflares_ceo_has_threatened_to_pull_the/,,Politics,False,theregister.com
1qxx4tb,"Charlize Theron’s speech at the Winter Olympics Opening Ceremony in Milan: “Peace is not just the absence of conflict. Peace is the creation of an environment where all can flourish, regardless of race, colour, creed, religion, gender, class, caste or any other social markers of difference.”",cmaia1503,Fauxmoi,22196,0.98,260,1770419526.0,2026-02-06 23:12:06,https://v.redd.it/zk6pny77iyhg1,https://www.reddit.com/r/Fauxmoi/comments/1qxx4tb/charlize_therons_speech_at_the_winter_olympics/,,SPORTS SECTION,False,v.redd.it
1r2o6g5,Ukraine's Vladyslav Heraskevych out of Winter Olympics over banned helmet honoring war dead,TheGreatDomilies,news,7920,0.97,322,1770885232.0,2026-02-12 08:33:52,https://apnews.com/article/heraskevych-helmet-ukraine-olympics-skeleton-9f304e1ff834ddab33af2f4e003f04a8,https://www.reddit.com/r/news/comments/1r2o6g5/ukraines_vladyslav_heraskevych_out_of_winter/,,,False,apnews.com
1r4ocax,"Winter Olympics in crisis as athletes deplete entire stock of 10,000 free condoms",tylerthe-theatre,europe,5741,0.91,374,1771085078.0,2026-02-14 16:04:38,https://www.independent.co.uk/sport/olympics/winter-olympics/winter-olympics-free-condoms-valentines-b2920445.html,https://www.reddit.com/r/europe/comments/1r4ocax/winter_olympics_in_crisis_as_athletes_deplete/,,News,False,independent.co.uk
1qva1qr,Team Mongolia will be wearing Goyol Cashmere for their ceremonial and casual looks at the 2026 Winter Olympics.,Murky_Chemical891,popculturechat,16585,0.99,236,1770166524.0,2026-02-04 00:55:24,https://www.reddit.com/gallery/1qva1qr,https://www.reddit.com/r/popculturechat/comments/1qva1qr/team_mongolia_will_be_wearing_goyol_cashmere_for/,,Sports Section 🏈⚽️,False,reddit.com
1qxw9q6,"OC: Erin Jackson, the first Black woman to win ind. gold at the Winter Olympics, leads Team USA",nbcnews,pics,18004,0.97,204,1770417464.0,2026-02-06 22:37:44,https://i.redd.it/egm2mr32cyhg1.png,https://www.reddit.com/r/pics/comments/1qxw9q6/oc_erin_jackson_the_first_black_woman_to_win_ind/,,,False,i.redd.it
1quucdk,Lindsey Vonn will compete at the 2026 Winter Olympics despite ‘completely ruptured’ ACL injury,MadnessLLD,sports,3345,0.96,564,1770131190.0,2026-02-03 15:06:30,https://www.cnn.com/2026/02/03/sport/lindsey-vonn-injury-latest-winter-olympics,https://www.reddit.com/r/sports/comments/1quucdk/lindsey_vonn_will_compete_at_the_2026_winter/,,:olympics: Olympics,False,cnn.com
1qyp8gq,Israeli Olympic team booed at 2026 Winter Olympics opening ceremony,EclecticEel,videos,2821,0.88,637,1770497925.0,2026-02-07 20:58:45,https://vimeo.com/1162887129?share=copy&amp;fl=sv&amp;fe=ci,https://www.reddit.com/r/videos/comments/1qyp8gq/israeli_olympic_team_booed_at_2026_winter/,,,False,vimeo.com
1r6sivh,ELI5 How did Norway become so dominant in the Winter Olympics?,El-Viking,explainlikeimfive,2239,0.86,848,1771291935.0,2026-02-17 01:32:15,https://www.reddit.com/r/explainlikeimfive/comments/1r6sivh/eli5_how_did_norway_become_so_dominant_in_the/,https://www.reddit.com/r/explainlikeimfive/comments/1r6sivh/eli5_how_did_norway_become_so_dominant_in_the/,"Specifically, why does Norway fare so much better compared to other Nordic/Scandinavian/Arctic countries?",Technology,True,self.explainlikeimfive
1qyhkr0,X actively took down videos of JD Vance being booed in the Winter Olympics.,TORUKMACTO92,WhitePeopleTwitter,19630,0.98,179,1770480251.0,2026-02-07 16:04:11,https://i.redd.it/bkflidwri3ig1.jpeg,https://www.reddit.com/r/WhitePeopleTwitter/comments/1qyhkr0/x_actively_took_down_videos_of_jd_vance_being/,,r/All,False,i.redd.it
1qaqnx7,"TIL that violinist Vanessa-Mae became an Olympic skier. She took part in the 2014 Winter Olympics in Alpine skiing. She came last out of 67. Her selection became controversial due to questions around qualification and allegations of race fixing, claims that were not substantiated.",johnsmithoncemore,todayilearned,5741,0.95,345,1768210815.0,2026-01-12 09:40:15,https://en.wikipedia.org/wiki/Vanessa-Mae#Investigation_and_appeal,https://www.reddit.com/r/todayilearned/comments/1qaqnx7/til_that_violinist_vanessamae_became_an_olympic/,,,False,en.wikipedia.org
1qk5kgx,Stars of gay hockey show ‘Heated Rivalry’ will be Winter Olympics torchbearers,BloodJunkie,hockey,3622,0.85,485,1769113202.0,2026-01-22 20:20:02,https://www.outsports.com/2026/1/22/24126479/heated-rivalry-winter-olympics-torch-relay-connor-storrie-hudson-williams/,https://www.reddit.com/r/hockey/comments/1qk5kgx/stars_of_gay_hockey_show_heated_rivalry_will_be/,,[hockey flaired users only],False,outsports.com
1r3qsli,"Sex-mad Winter Olympics stars run out of condoms in three days despite 10,000 freebies",bolshoybooze,BrandNewSentence,8557,0.97,217,1770993393.0,2026-02-13 14:36:33,https://i.redd.it/jgov4ewlw9jg1.jpeg,https://www.reddit.com/r/BrandNewSentence/comments/1r3qsli/sexmad_winter_olympics_stars_run_out_of_condoms/,,,False,i.redd.it
1r66gtm,Winter Olympics: 500m shorttrack photo finish,Gregardus,funny,6903,0.97,231,1771238869.0,2026-02-16 10:47:49,https://i.redd.it/4ieynt1j6ujg1.png,https://www.reddit.com/r/funny/comments/1r66gtm/winter_olympics_500m_shorttrack_photo_finish/,,,False,i.redd.it
1r6ohwh,The back of the big air ramp is seen on day seven of the Milano Cortina 2026 Winter Olympic games,unfocusleft,pics,6604,0.99,214,1771281787.0,2026-02-16 22:43:07,https://i.redd.it/ct3hs5l5qxjg1.jpeg,https://www.reddit.com/r/pics/comments/1r6ohwh/the_back_of_the_big_air_ramp_is_seen_on_day_seven/,,,False,i.redd.it
1r9w5ui,"Norway wins its 17th gold medal, breaking its record for most golds won in a single Winter Olympics",Oldtimer_2,sports,5397,0.98,235,1771596140.0,2026-02-20 14:02:20,https://apnews.com/article/winter-olympics-norway-gold-record-biathlon-8d64eaeceeaf2d94e36df59d8d204639,https://www.reddit.com/r/sports/comments/1r9w5ui/norway_wins_its_17th_gold_medal_breaking_its/,,:olympics: Olympics,False,apnews.com
1qocd2e,"ICE Agents Set to Have Security Role During Winter Olympics in Italy, Prompting Uproar",Infidel8,politics,3064,0.97,456,1769516515.0,2026-01-27 12:21:55,https://variety.com/2026/sports/global/ice-agents-security-winter-olympics-games-italy-1236642001/,https://www.reddit.com/r/politics/comments/1qocd2e/ice_agents_set_to_have_security_role_during/,,No Paywall,False,variety.com
1qxzwnc,“I Feel Bad For The Athletes”: JD Vance Gets Booed At The Winter Olympics Inauguration Ceremony,SecretPlum1,newsinterpretation,4409,0.97,291,1770426565.0,2026-02-07 01:09:25,https://www.boredpanda.com/jd-vance-gets-booed-at-the-winter-olympics-inauguration-ceremony/?utm_source=reddit&amp;utm_medium=link&amp;utm_campaign=distinct0197,https://www.reddit.com/r/newsinterpretation/comments/1qxzwnc/i_feel_bad_for_the_athletes_jd_vance_gets_booed/,,,False,boredpanda.com
1qzod9t,"Do you think the Southern Hemisphere will ever host a Winter Olympic Games? If so, which country?",Lissandra_Freljord,geography,1976,0.95,816,1770593407.0,2026-02-08 23:30:07,https://i.redd.it/i55q8j5urcig1.png,https://www.reddit.com/r/geography/comments/1qzod9t/do_you_think_the_southern_hemisphere_will_ever/,,Discussion,False,i.redd.it
1r9lp33,The moment Ami Nakai realized her placement | Winter Olympics 2026,oncetwice1020,FigureSkating,7652,1.0,186,1771561713.0,2026-02-20 04:28:33,https://v.redd.it/tac34oy5ukkg1,https://www.reddit.com/r/FigureSkating/comments/1r9lp33/the_moment_ami_nakai_realized_her_placement/,,,False,v.redd.it
1qp9oww,Italy’s foreign minister defends ICE attendance at Winter Olympics: ‘It’s not the SS’,tylerthe-theatre,europe,2146,0.92,697,1769602333.0,2026-01-28 12:12:13,https://www.independent.co.uk/news/world/europe/italy-ice-winter-olympics-backlash-ss-b2909240.html,https://www.reddit.com/r/europe/comments/1qp9oww/italys_foreign_minister_defends_ice_attendance_at/,,News,False,independent.co.uk
1r5oagz,Inside Italy’s Abandoned Winter Olympic Sites,BWT_Urbex,abandoned,6340,0.99,200,1771185414.0,2026-02-15 19:56:54,https://www.reddit.com/gallery/1r5oagz,https://www.reddit.com/r/abandoned/comments/1r5oagz/inside_italys_abandoned_winter_olympic_sites/,"While everyone's watching the Milano Cortina 2026 Winter Games, we went to the part nobody broadcasts: the abandoned venues that were left behind. These photos are from two abandoned sites of Torino 2006: Cesana Pariol (ice track for bobsleigh, luge &amp; skeleton), and Pragelato (the ski jump stadium). What shocked us: parts of it are still in surprisingly good shape, even after nearly 20 years. And yet, they didn't reuse these sites. See more on YouTube: [https://youtu.be/jkMT1habyT8](https://youtu.be/jkMT1habyT8)",,False,reddit.com
1r42m89,Winter Olympics 2026 men's figure skating live updates: Ilia Malinin fails to medal after falling twice in final skate,ReaddittiddeR,sports,2136,0.95,568,1771020245.0,2026-02-13 22:04:05,https://www.nytimes.com/athletic/live-blogs/mens-figure-skating-final-live-updates-winter-olympics-2026-ilia-malinin/Fo8oXechGOK9/,https://www.reddit.com/r/sports/comments/1r42m89/winter_olympics_2026_mens_figure_skating_live/,,:skating: Skating,False,nytimes.com
1ra80y4,"Polish athlete Kamila Sellier almost loses an eye at the Winter Olympics (She's fine, thankfully)",PolylingualAnilingus,SweatyPalms,9003,0.98,153,1771622702.0,2026-02-20 21:25:02,https://v.redd.it/1s35pfatvpkg1,https://www.reddit.com/r/SweatyPalms/comments/1ra80y4/polish_athlete_kamila_sellier_almost_loses_an_eye/,,Disasters &amp; accidents,False,v.redd.it
1qxuurb,"US athletes cheered, JD Vance booed during Winter Olympics opening ceremony",Rock-n-roll-Kevin,politics,8544,0.98,166,1770414121.0,2026-02-06 21:42:01,https://www.usatoday.com/story/sports/olympics/2026/02/06/team-usa-2026-winter-olympics-opening-ceremony-reception/88544770007/,https://www.reddit.com/r/politics/comments/1qxuurb/us_athletes_cheered_jd_vance_booed_during_winter/,,No Paywall,False,usatoday.com
1ra00cj,Nancy and Tonya (Winter Olympics 1994),Margoshome,GenerationJones,2716,0.99,336,1771604929.0,2026-02-20 16:28:49,https://i.redd.it/xi9w146xeokg1.jpeg,https://www.reddit.com/r/GenerationJones/comments/1ra00cj/nancy_and_tonya_winter_olympics_1994/,,,False,i.redd.it
1r5voq7,Japanese freestyle skier Ikuma Horishima crosses finish line backwards at Winter Olympics,ShiroSara,interestingasfuck,11437,0.98,141,1771203963.0,2026-02-16 01:06:03,https://v.redd.it/233a8neqarjg1,https://www.reddit.com/r/interestingasfuck/comments/1r5voq7/japanese_freestyle_skier_ikuma_horishima_crosses/,,,False,v.redd.it
1qo8o4r,Winter Olympics skeleton controversy rolls on as US athlete looks to JD Vance for help,graveyardofgoodsense,sports,2533,0.91,401,1769504133.0,2026-01-27 08:55:33,https://edition.cnn.com/2026/01/26/sport/olympics-2026-katie-uhlaender-seeking-spot-milan-cortina,https://www.reddit.com/r/sports/comments/1qo8o4r/winter_olympics_skeleton_controversy_rolls_on_as/,,:news: News,False,edition.cnn.com
1r8if3z,A Czechoslovakian wolfdog crashed a 2026 Winter Olympics Race and deserves a medal and some treats....,Silent-Resort-3076,Awww,11194,0.98,130,1771455872.0,2026-02-18 23:04:32,https://v.redd.it/wfuq44bz2ckg1,https://www.reddit.com/r/Awww/comments/1r8if3z/a_czechoslovakian_wolfdog_crashed_a_2026_winter/,,,False,v.redd.it
1r72qqp,Norway is a Winter Olympic giant. Why isn’t it better at ice hockey ?,Shroft,hockey,1729,0.95,554,1771325000.0,2026-02-17 10:43:20,https://www.nytimes.com/athletic/7050048/2026/02/17/winter-olympics-2026-norway-hockey/,https://www.reddit.com/r/hockey/comments/1r72qqp/norway_is_a_winter_olympic_giant_why_isnt_it/,,[Paywall],False,nytimes.com
1qy96ig,Bloody Winter Olympic 2026,Icy_Till_7254,ukraine,7971,0.97,148,1770455335.0,2026-02-07 09:08:55,https://www.reddit.com/gallery/1qy96ig,https://www.reddit.com/r/ukraine/comments/1qy96ig/bloody_winter_olympic_2026/,When ruzzia and bel@ruz once travelled their way through Beyond joke “neutrality team”.,:Art: Art Friday,False,reddit.com
1r6nj4k,Georgia has won first ever Winter’s Olympic medal!!,ZucchiniFluid4229,olympics,6388,0.99,153,1771279588.0,2026-02-16 22:06:28,https://i.redd.it/nbz9ph8mjxjg1.jpeg,https://www.reddit.com/r/olympics/comments/1r6nj4k/georgia_has_won_first_ever_winters_olympic_medal/,🇬🇪🇬🇪,❄ Milano-Cortina 2026 (Official Result) ❄,False,i.redd.it
1r870k8,A dog crossed the 2026 Winter Olympics cross-country finish line,humankendoll33,animalsdoingstuff,3427,0.97,224,1771430776.0,2026-02-18 16:06:16,https://v.redd.it/dw91a5v51akg1,https://www.reddit.com/r/animalsdoingstuff/comments/1r870k8/a_dog_crossed_the_2026_winter_olympics/,,! Good boy !,False,v.redd.it
1r3wh5g,The Winter Olympics Televised Apology Isn’t Romantic – It's Manipulation,nextquestioncya,TwoXChromosomes,5393,0.95,159,1771006153.0,2026-02-13 18:09:13,https://www.glamourmagazine.co.uk/article/winter-olympics-sturla-holm-laegreid,https://www.reddit.com/r/TwoXChromosomes/comments/1r3wh5g/the_winter_olympics_televised_apology_isnt/,"There's something very annoying knowing this woman is likely now being questioned by everyone she knows as to whether she's going to take him back. The betrayal was done quietly but the apology is life alteringly loud.

  
Have you ever had someone go around making themselves look like a martyr after wronging you? I hope she's OK.",,False,glamourmagazine.co.uk
1qx2qyd,Haiti’s Winter Olympic uniforms by Italian-Haitian designer Stella Jean. The only hand painted uniforms at the games.,pinkstarrfish,Fauxmoi,10952,0.99,121,1770337862.0,2026-02-06 00:31:02,https://www.reddit.com/gallery/1qx2qyd,https://www.reddit.com/r/Fauxmoi/comments/1qx2qyd/haitis_winter_olympic_uniforms_by_italianhaitian/,https://www.essence.com/news/haiti-winter-olympics-uniforms/,SPORTS SECTION,False,reddit.com
1r2qhci,🇺🇦 Olympic president visibly upset as Ukrainian athlete is expelled from the Winter Games over banned helmet which honours athletes killed in the war,Timbucktwo1230,PopularCultureZone,3616,0.97,192,1770893913.0,2026-02-12 10:58:33,https://i.redd.it/i8oy7c2to1jg1.jpeg,https://www.reddit.com/r/PopularCultureZone/comments/1r2qhci/olympic_president_visibly_upset_as_ukrainian/,,Sports Culture ⚽️ 🏉 🎾 ,False,i.redd.it
1qyegrb,Israeli team booed at 2026 Winter Olympics opening ceremony,Particular_Log_3594,ABoringDystopia,6162,0.97,140,1770472677.0,2026-02-07 13:57:57,https://v.redd.it/icuf4rs8w2ig1,https://www.reddit.com/r/ABoringDystopia/comments/1qyegrb/israeli_team_booed_at_2026_winter_olympics/,,,False,v.redd.it
1qxvnqc,Angry Italians boo American athletes and JD Vance at Winter Olympics,Prosecco1234,BoycottUnitedStates,3126,0.97,211,1770416017.0,2026-02-06 22:13:37,https://www.dailymail.co.uk/sport/winterolympics/article-15536639/italians-boo-american-athletes-jd-vance-olympics.html,https://www.reddit.com/r/BoycottUnitedStates/comments/1qxvnqc/angry_italians_boo_american_athletes_and_jd_vance/,,,False,dailymail.co.uk
1qok1zg,Italians Protest US Plans to Deploy ICE at Winter Olympics,bloomberg,europe,3601,0.98,199,1769534296.0,2026-01-27 17:18:16,https://www.bloomberg.com/news/articles/2026-01-27/italians-protest-us-plans-to-deploy-ice-at-winter-olympics,https://www.reddit.com/r/europe/comments/1qok1zg/italians_protest_us_plans_to_deploy_ice_at_winter/,,News,False,bloomberg.com
1qy384n,Israel team marches to boos at Milan Winter Olympics opening ceremony,DonSalaam,International,2716,0.94,236,1770435744.0,2026-02-07 03:42:24,https://www.timesofisrael.com/israel-team-marches-to-smattering-of-boos-at-milan-winter-olympics-opening-ceremony/,https://www.reddit.com/r/International/comments/1qy384n/israel_team_marches_to_boos_at_milan_winter/,,,False,timesofisrael.com
1r6nwsv,Taylor introducing the US Women Figure Skaters at the 2026 Winter Olympics,icyfirework,TaylorSwift,5959,0.97,129,1771280445.0,2026-02-16 22:20:45,https://v.redd.it/drjmv292mxjg1,https://www.reddit.com/r/TaylorSwift/comments/1r6nwsv/taylor_introducing_the_us_women_figure_skaters_at/,,Official Social Media ☑️,False,v.redd.it
1qoi9ta,Trump wanted to send ICE to Italy for the Winter Olympics.,justalazygamer,WhitePeopleTwitter,4091,1.0,179,1769530598.0,2026-01-27 16:16:38,https://i.redd.it/blur241w2xfg1.png,https://www.reddit.com/r/WhitePeopleTwitter/comments/1qoi9ta/trump_wanted_to_send_ice_to_italy_for_the_winter/,,,False,i.redd.it
1r4kupn,Lucas Pinheiro Braathen wins first ever medal for Brasil in Winter Olympics,Disastrous_Source977,olympics,4600,0.99,150,1771076330.0,2026-02-14 13:38:50,https://i.redd.it/o9hdnn68rgjg1.jpeg,https://www.reddit.com/r/olympics/comments/1r4kupn/lucas_pinheiro_braathen_wins_first_ever_medal_for/,,❄ Milano-Cortina 2026 (News) ❄,False,i.redd.it
1r4o7j7,Countries that have won gold medals in Winter Olympics,RN_Renato,MapPorn,1880,0.97,310,1771084773.0,2026-02-14 15:59:33,https://i.redd.it/8l63maubghjg1.png,https://www.reddit.com/r/MapPorn/comments/1r4o7j7/countries_that_have_won_gold_medals_in_winter/,,,False,i.redd.it
1ra9zcr,Team USA Men's Hockey team takes down Team Slovakia 6-2 in the Semi-Finals of the 2026 Winter Olympics. They will head into a final showdown with arch-rivals Team Canada in the Finals.,Yujin-Ha,sports,2191,0.93,247,1771627318.0,2026-02-20 22:41:58,https://v.redd.it/b3jztq1l9qkg1,https://www.reddit.com/r/sports/comments/1ra9zcr/team_usa_mens_hockey_team_takes_down_team/,,:hockey: Hockey,False,v.redd.it
1r5ocnb,What Nobody Shows You About Italy’s Winter Olympic Games (abandoned venues),BWT_Urbex,urbanexploration,4582,0.98,138,1771185553.0,2026-02-15 19:59:13,https://www.reddit.com/gallery/1r5ocnb,https://www.reddit.com/r/urbanexploration/comments/1r5ocnb/what_nobody_shows_you_about_italys_winter_olympic/,"While everyone's watching the Milano Cortina 2026 Winter Games, we went to the part nobody broadcasts: the abandoned venues that were left behind. These photos are from two abandoned sites of Torino 2006: Cesana Pariol (ice track for bobsleigh, luge &amp; skeleton), and Pragelato (the ski jump stadium). What shocked us: parts of it are still in surprisingly good shape, even after nearly 20 years. And yet, they didn't reuse these sites. See more on YouTube: [https://youtu.be/jkMT1habyT8](https://youtu.be/jkMT1habyT8)",,False,reddit.com
1r3hnyu,‘It’s emptiness’: banned Ukrainian athlete accuses IOC of fuelling Russia’s propaganda | Winter Olympics 2026,HydrolicKrane,sports,2599,0.93,206,1770963444.0,2026-02-13 06:17:24,https://www.theguardian.com/sport/2026/feb/12/ukraine-vladyslav-heraskevych-disqualified-winter-olympics-skeleton-helmet-protest-war-deaths,https://www.reddit.com/r/sports/comments/1r3hnyu/its_emptiness_banned_ukrainian_athlete_accuses/,,:olympics: Olympics,False,theguardian.com
1r12k60,Doggo just wanted a chance to compete in the Winter Olympics,NowhereAllAtOnce,MadeMeSmile,3705,0.97,155,1770734542.0,2026-02-10 14:42:22,https://v.redd.it/ezcfz4ivioig1,https://www.reddit.com/r/MadeMeSmile/comments/1r12k60/doggo_just_wanted_a_chance_to_compete_in_the/,,,False,v.redd.it
1r9enf8,Team Poland’s pierogi becomes an unofficial mascot at the Winter Olympics,bbyxmadi,popculturechat,9199,1.0,92,1771542697.0,2026-02-19 23:11:37,https://www.reddit.com/gallery/1r9enf8,https://www.reddit.com/r/popculturechat/comments/1r9enf8/team_polands_pierogi_becomes_an_unofficial_mascot/,,Sports Section 🏈⚽️,False,reddit.com
1qrb2es,Italy’s foreign minister defends ICE attendance at Winter Olympics: ‘It’s not the SS’,YesNo_Maybe_,sports,1592,0.89,365,1769792359.0,2026-01-30 16:59:19,https://www.independent.co.uk/news/world/europe/italy-ice-winter-olympics-backlash-ss-b2909240.html?test_group=lighteradlayout,https://www.reddit.com/r/sports/comments/1qrb2es/italys_foreign_minister_defends_ice_attendance_at/,,:olympics: Olympics,False,independent.co.uk
1qyb3fg,The Ukrainian team at the Winter Olympics in Milan,goldstarflag,europe,11589,0.98,86,1770462403.0,2026-02-07 11:06:43,https://i.redd.it/u03v8lyb12ig1.jpeg,https://www.reddit.com/r/europe/comments/1qyb3fg/the_ukrainian_team_at_the_winter_olympics_in_milan/,,Picture,False,i.redd.it
1r2sbuo,Cooper Woods wins GOLD for Australia in our first medal of these Winter Olympics 🥇🇦🇺,Tillysnow1,australia,3811,0.97,133,1770899893.0,2026-02-12 12:38:13,https://v.redd.it/oxl7jn7k62jg1,https://www.reddit.com/r/australia/comments/1r2sbuo/cooper_woods_wins_gold_for_australia_in_our_first/,,Olympics,False,v.redd.it
1r5flj7,ELI5 How do they guarantee so much snow at the Winter Olympics?,Cosmic-burst,explainlikeimfive,1697,0.91,265,1771164743.0,2026-02-15 14:12:23,https://www.reddit.com/r/explainlikeimfive/comments/1r5flj7/eli5_how_do_they_guarantee_so_much_snow_at_the/,https://www.reddit.com/r/explainlikeimfive/comments/1r5flj7/eli5_how_do_they_guarantee_so_much_snow_at_the/,"I’m loving watching the various winter sports but I can’t work out how the snow is such thick coverage for the snowboarding and skiing events. 

I know it has been snowing a fair bit as well. If it’s also raining, won’t that turn the snow into a slurry at some points.

The surrounding mountains are full of snow but it doesn’t look thick enough for what is seen for the events, e.g snowboarding or alpine skiing. 

Are they using artificial snow? Would that impact the athletes? 

ELI5 please. I live somewhere where there is very little snow nowadays and when there is, it very quickly turns into slush. ",Other,True,self.explainlikeimfive
1qskw4x,"Italians protest ICE's presence at the upcoming 2026 Winter Olympics, CNN's Antonia Mortensen reports from Milan, where around 8,000 people showed up to protest.",ControlCAD,goodnews,4740,0.98,119,1769910021.0,2026-02-01 01:40:21,https://v.redd.it/1iha2yw5fsgg1,https://www.reddit.com/r/goodnews/comments/1qskw4x/italians_protest_ices_presence_at_the_upcoming/,,Political positivity 📈,False,v.redd.it
1r1g0cz,[Autosport] Sebastian Vettel using his old Ferrari headshot for his Winter Olympics accreditation.,Maximum-Room-3999,formula1,6290,0.99,94,1770764015.0,2026-02-10 22:53:35,https://i.redd.it/lxw3xs0kyqig1.jpeg,https://www.reddit.com/r/formula1/comments/1r1g0cz/autosport_sebastian_vettel_using_his_old_ferrari/,,:post-photo: Photo,False,i.redd.it
1qxx0sl,TIL may participants tayo para sa alpine skiing ngayong winter olympics 2026,124C1SELF,todayIlearnedPH,3683,0.99,126,1770419257.0,2026-02-06 23:07:37,https://v.redd.it/9dx9lihehyhg1,https://www.reddit.com/r/todayIlearnedPH/comments/1qxx0sl/til_may_participants_tayo_para_sa_alpine_skiing/,,,False,v.redd.it
1qwtu5j,How penis injections became a Winter Olympic talking point,m1n3c7afty,nottheonion,1728,0.95,244,1770317336.0,2026-02-05 18:48:56,https://www.bbc.co.uk/sport/articles/czej70jyg4eo,https://www.reddit.com/r/nottheonion/comments/1qwtu5j/how_penis_injections_became_a_winter_olympic/,,,False,bbc.co.uk
1qy1qcy,Ukraine gets one of the biggest applauses at the Winter Olympics,Harvickfan4Life,ukraine,10281,0.99,75,1770431550.0,2026-02-07 02:32:30,https://i.redd.it/x8tt6rryhzhg1.jpeg,https://www.reddit.com/r/ukraine/comments/1qy1qcy/ukraine_gets_one_of_the_biggest_applauses_at_the/,,Sports,False,i.redd.it
1qyp18t,Italy says railways hit by 'serious sabotage' as Winter Olympics begin,Ki1664,europe,3522,0.99,127,1770497443.0,2026-02-07 20:50:43,https://www.bbc.co.uk/news/articles/czr4rx04xjpo,https://www.reddit.com/r/europe/comments/1qyp18t/italy_says_railways_hit_by_serious_sabotage_as/,,News,False,bbc.co.uk
1r4qrer,Lucas Pinheiro Braathen from Brazil has won Brazil and South America's first gold medal ever at the Winter Olympics (in men's giant slalom),mcfw31,MadeMeSmile,5922,0.99,90,1771090764.0,2026-02-14 17:39:24,https://i.redd.it/t8o2cwvzxhjg1.jpeg,https://www.reddit.com/r/MadeMeSmile/comments/1r4qrer/lucas_pinheiro_braathen_from_brazil_has_won/,,:snoo_hearteyes: Wholesome Moments :snoo_simple_smile:,False,i.redd.it
1qyfcsb,Israeli team booed at 2026 Winter Olympics opening ceremony,Particular_Log_3594,behindthebastards,1952,0.98,205,1770474958.0,2026-02-07 14:35:58,https://v.redd.it/305jfv0133ig1,https://www.reddit.com/r/behindthebastards/comments/1qyfcsb/israeli_team_booed_at_2026_winter_olympics/,,Politics,False,v.redd.it
1r8t2n2,Wolfdog invades Winter Olympics Women's cross country skiing race,Gjore,interestingasfuck,2646,0.97,137,1771486916.0,2026-02-19 07:41:56,https://v.redd.it/yn4126d2oekg1,https://www.reddit.com/r/interestingasfuck/comments/1r8t2n2/wolfdog_invades_winter_olympics_womens_cross/,,,False,v.redd.it
1r869nz,A stray dog stole the spotlight at the Winter Olympics as it ran onto the course during the women's cross-country skiing race,Objective_Pilot_5834,interesting,1781,0.96,192,1771429133.0,2026-02-18 15:38:53,https://v.redd.it/xh7pkraaw9kg1,https://www.reddit.com/r/interesting/comments/1r869nz/a_stray_dog_stole_the_spotlight_at_the_winter/,,Context Provided - Spotlight,False,v.redd.it
