id,title,author,subreddit,score,upvote_ratio,num_comments,created_utc,created_date,url,permalink,selftext,link_flair_text,is_self,domain
1r4ktw8,"Lucas Pinheiro Braathen wins Brazil's first ever Winter Olympic medal and it's GOLD!

An incredible performance by the Brazilian skier who creates history in the Milan-Cortina games.

It's also the first ever gold medal at the Winter Olympics for a South American nation.",JOE_Media,Brazil,1779,0.99,85,1771076268.0,2026-02-14 13:37:48,https://i.redd.it/q16fqjzyqgjg1.png,https://www.reddit.com/r/Brazil/comments/1r4ktw8/lucas_pinheiro_braathen_wins_brazils_first_ever/,,News,False,i.redd.it
1qy9bux,USA Winter Olympics sweater,Flaggermusmann,olympics,572,0.9,290,1770455887.0,2026-02-07 09:18:07,https://i.redd.it/qac7gexbi1ig1.jpeg,https://www.reddit.com/r/olympics/comments/1qy9bux/usa_winter_olympics_sweater/,,❄ Milano-Cortina 2026 (General Discussion) ❄,False,i.redd.it
1r1t9l8,The winter Olympics have got me thinking about the lack of opportunity in Australian public schools,Sriracha_Sauce089,australian,360,0.75,498,1770803644.0,2026-02-11 09:54:04,https://www.reddit.com/r/australian/comments/1r1t9l8/the_winter_olympics_have_got_me_thinking_about/,https://www.reddit.com/r/australian/comments/1r1t9l8/the_winter_olympics_have_got_me_thinking_about/,"I'm watching the winter Olympics and thinking who are these Aussie Olympians that became so talented that they can compete on the world stage for sports that are not common in Australia.

Growing up in a fairly low socioeconomic area and attending a public high school, I was never afforded the opportunity to try a winter snow sport and if you weren't going with school, you'd have to go with family but most of the kids I grew up with didn't get that opportunity either because their families couldn't afford to go to the snow as it would cost so much. Presumably then, these Olympians would come from fairly wealthy backgrounds? To think how much talent Australia has missed out on if they only gave the low socioeconomic class a chance to try a snow sport. Talent is of course important but it seems like in the case for Australia and snow sports, so is coming from wealthy backgrounds.

Let's take tennis for example, a traditionally rich people sport. If a poor kid wants to give it a go, they could do it with their school or go to their local tennis courts and see if they like it. Should they like it and are good at it, the chances of them getting far is still slim but possible and more importantly they got the opportunity to try it out. A rich kid on the other hand, gets the opportunity to try it and should they be talented enough, has a good chance to get to elite level. Now with snow sports, a poor kid wouldn't even get a chance to try it, nevermind figuring out if they are talented. A rich kid, does have the opportunity to try it out due to their wealth.

I'm not hating on the Olympians btw, this issue is not their fault at all and they are obviously still talented and got to where they are with hard work and I hope they do well. It's the unequal education system that is a problem.

What are other people's experiences in terms of if their school offered snow sports?

TL;DR is it fair to say that any Aussie Olympians are from fairly wealthy backgrounds and those from low socioeconomic backgrounds are not given the opportunity to try these snow sports?

EDIT: wow an awesome response turnout. Can't get to all your comments but appreciate those among you that were able to have a mature discussion whether you agree or disagree. Now let's get behind our Aussies at the winter Olympics!

P.S. for those saying there are bigger problems, yes I am aware and have discussions about bigger problems at other times. It doesn't mean that we are forbidden from talking about anything else because there's bigger problems so I thought given the winter Olympics are on right now, it would be an interesting topic for discussion.",Community,True,self.australian
1q6kkom,"Winter Olympics hockey venues might not be fully finished for competition, official admits",Old_General_6741,hockey,784,0.97,230,1767804625.0,2026-01-07 16:50:25,https://www.cnn.com/2026/01/07/sport/olympics-2026-hockey-arena-delays,https://www.reddit.com/r/hockey/comments/1q6kkom/winter_olympics_hockey_venues_might_not_be_fully/,,,False,cnn.com
1qonz5v,"US to send ICE to Italy for Winter Olympics... is this the beginning of the end, or has it already started?",Legitimate-Loan-2540,complaints,707,0.98,228,1769542374.0,2026-01-27 19:32:54,https://i.redd.it/9yktd0yr1yfg1.png,https://www.reddit.com/r/complaints/comments/1qonz5v/us_to_send_ice_to_italy_for_winter_olympics_is/,[https://www.bbc.co.uk/news/articles/c5y29xzjdzvo](https://www.bbc.co.uk/news/articles/c5y29xzjdzvo),Politics,False,i.redd.it
1qy5qv6,Team Ukraine receives an ovation as they’re introduced at the Winter Olympics opening ceremony 🇺🇦,snfssmc,ukraine,4399,1.0,38,1770443343.0,2026-02-07 05:49:03,https://v.redd.it/ua1qqh61h0ig1,https://www.reddit.com/r/ukraine/comments/1qy5qv6/team_ukraine_receives_an_ovation_as_theyre/,,Sports,False,v.redd.it
1r4ibfj,Australia has won 3 golds at a Winter Olympics for the first time,Jackomillard15,olympics,1269,0.99,108,1771068430.0,2026-02-14 11:27:10,https://i.redd.it/bsos2ybq3gjg1.jpeg,https://www.reddit.com/r/olympics/comments/1r4ibfj/australia_has_won_3_golds_at_a_winter_olympics/,,❄ Milano-Cortina 2026 (News) ❄,False,i.redd.it
1r4oxyn,Brazil has more gold than Canada at the Winter Olympics,GapYearGuy2018,TeamCanada,512,0.79,280,1771086531.0,2026-02-14 16:28:51,https://i.redd.it/7leots5klhjg1.jpeg,https://www.reddit.com/r/TeamCanada/comments/1r4oxyn/brazil_has_more_gold_than_canada_at_the_winter/,,,False,i.redd.it
