id,title,author,subreddit,score,upvote_ratio,num_comments,created_utc,created_date,url,permalink,selftext,link_flair_text,is_self,domain
1r0f8wd,Speed skating went massively viral at the 2026 Winter Olympics — all thanks to Dutch athlete Jutta Leerdam 🔥,OneOriginal8727,sportsgossips,5429,0.91,660,1770668272.0,2026-02-09 20:17:52,https://v.redd.it/5xkdefjoyiig1,https://www.reddit.com/r/sportsgossips/comments/1r0f8wd/speed_skating_went_massively_viral_at_the_2026/,,Opinion,False,v.redd.it
1qz957q,Winter Olympics really are something else,underrealizing,olympics,43530,0.98,821,1770557915.0,2026-02-08 13:38:35,https://i.redd.it/01nzzzopx9ig1.jpeg,https://www.reddit.com/r/olympics/comments/1qz957q/winter_olympics_really_are_something_else/,,❄ Milano-Cortina 2026 (General Discussion) ❄,False,i.redd.it
1qdgrm2,Friendly reminder that Winter Olympics will start soon.,Kurdt93,2westerneurope4u,2065,0.95,157,1768475406.0,2026-01-15 11:10:06,https://v.redd.it/2exo59tbxhdg1,https://www.reddit.com/r/2westerneurope4u/comments/1qdgrm2/friendly_reminder_that_winter_olympics_will_start/,"Gotcha, degenerates.",:European: META,False,v.redd.it
1qxvigy,US VP JD Vance getting booed during 2026 Winter Olympics opening ceremony,Yujin-Ha,sports,97188,0.91,793,1770415668.0,2026-02-06 22:07:48,https://v.redd.it/uu1pbq0q6yhg1,https://www.reddit.com/r/sports/comments/1qxvigy/us_vp_jd_vance_getting_booed_during_2026_winter/,,:olympics: Olympics,False,v.redd.it
1qxw9ko,You guys saw the winter Olympics opening ceremony?,findergrrr,conspiracy,1974,0.9,464,1770417453.0,2026-02-06 22:37:33,https://i.redd.it/uhrsmoq1cyhg1.jpeg,https://www.reddit.com/r/conspiracy/comments/1qxw9ko/you_guys_saw_the_winter_olympics_opening_ceremony/,,,False,i.redd.it
1q3quoq,"With the Winter Olympics coming soon within the next few weeks, it’s time to bring up this masterpiece",WarwickReider,popculturechat,3562,0.98,172,1767535810.0,2026-01-04 14:10:10,https://v.redd.it/jg9dhjm3bcbg1,https://www.reddit.com/r/popculturechat/comments/1q3quoq/with_the_winter_olympics_coming_soon_within_the/,Scott Moir and Tessa Virtue Ice Dance to Moulin Rouge ,Sports Section 🏈⚽️,False,v.redd.it
1qz4p2j,So Tragic Death at Winter Olympics 2010 💔,ShipComprehensive769,OlympicsV2,29,0.79,3,1770543205.0,2026-02-08 09:33:25,https://v.redd.it/ppkbkklyp8ig1,https://www.reddit.com/r/OlympicsV2/comments/1qz4p2j/so_tragic_death_at_winter_olympics_2010/,"On February 12, 2010, tragedy struck the Vancouver Winter Olympics when Nodar Kumaritashvili, a 21-year-old luger from Georgia, was killed during a training run at the Whistler Sliding Centre, just hours before the opening ceremony, after losing control of his sled on the final turn at speeds approaching 90 mph (144 km/

h) and being thrown from the track into an unpadded steel support beam, causing fatal injuries on impact; the horrifying accident shocked the world, exposed serious safety concerns about a track widely criticized as dangerously fast even for elite athletes, and prompted immediate action by organizers, who lowered the start position, modified the ice profile, and added protective barriers before competition resumed, marking the first athlete death at a Winter Olympics since 1992 and becoming a pivotal moment that permanently reshaped safety standards and track design in luge and other sliding sports.",,False,v.redd.it
1r0boi2,US-born Winter Olympics star Eileen Gu who turned her back on America to represent China misses out on gold,GetOutOfTheWhey,China,888,0.82,717,1770660659.0,2026-02-09 18:10:59,https://www.dailymail.co.uk/sport/winterolympics/article-15543103/eileen-gu-china-winter-olympics-silver.html,https://www.reddit.com/r/China/comments/1r0boi2/usborn_winter_olympics_star_eileen_gu_who_turned/,"Context:

* Eileen Gu fell on her final run, once more finished silver behind Switzerland’s Mathilde Gremaud, a result that deepens their friendly rivalry, common between athletes who continue to push the sporting world forward.
* Meanwhile triggered and grievance-driven, American fans seized on the moment to mock Gu’s fall, labeling her a traitor for representing China, and calling it “karma” for the crimes they believe she has committed.

American Comments identified by Daily Mail:

* ""Eileen Gu chose Communist China over the country she was born, raised, and trained. Why the hell is she being highlighted? She is a traitor""
* ""Hard to watch Eileen Gu compete for China after everything the U.S. did for her training. High treason""
* ""I've never seen NBC cover a Chinese athlete more. If she doesn't want to represent the Stars and Stripes than don't cover her. Period. We don't care if she's pretty and actually American. She's not on our team""
* ""karma for representing the wrong country of birth.""
* ""Lost to the Swiss Miss,"" another mocked referring to Gremaud
* 'No one cares. She's an American who is paid to snowboard for China,' one viewer bitterly declared.

Edit: OP's Warning

* Some comments below mirror the triggered comments the daily mail has identified. Please proceed with caution. None of them are overly abusive but some are really petty. Thou'st been warned.", 西方小报类媒体 | Tabloid Style Media ,False,dailymail.co.uk
1qcbh0m,"Why are the Winter Olympics much less popular than the Summer Olympics, even in countries where it snows?",No-StrategyX,answers,103,0.82,177,1768358420.0,2026-01-14 02:40:20,https://www.reddit.com/r/answers/comments/1qcbh0m/why_are_the_winter_olympics_much_less_popular/,https://www.reddit.com/r/answers/comments/1qcbh0m/why_are_the_winter_olympics_much_less_popular/,,,True,self.answers
1r88eog,Wolfdog invades Winter Olympics Women's cross country skiing race,Yujin-Ha,sports,80390,0.97,1665,1771433718.0,2026-02-18 16:55:18,https://v.redd.it/hra92s6x9akg1,https://www.reddit.com/r/sports/comments/1r88eog/wolfdog_invades_winter_olympics_womens_cross/,,:winter: Winter Sports,False,v.redd.it
1r10wte,Doggo just wanted a chance to compete in the Winter Olympics.,Objective_Pilot_5834,BeAmazed,71369,0.95,1593,1770730562.0,2026-02-10 13:36:02,https://v.redd.it/vac41rs27oig1,https://www.reddit.com/r/BeAmazed/comments/1r10wte/doggo_just_wanted_a_chance_to_compete_in_the/,,*The World Cup Super-G event in Bormio not Olympics,False,v.redd.it
1r5ol7a,Italy's Abandoned Winter Olympic Sites from 2006,BWT_Urbex,olympics,34214,0.98,1815,1771186101.0,2026-02-15 20:08:21,https://www.reddit.com/gallery/1r5ol7a,https://www.reddit.com/r/olympics/comments/1r5ol7a/italys_abandoned_winter_olympic_sites_from_2006/,"While everyone's watching the Milano Cortina 2026 Winter Games, we went to the part nobody broadcasts: the abandoned venues that were left behind. These photos are from two abandoned sites of Torino 2006: Cesana Pariol (ice track for bobsleigh, luge &amp; skeleton), and Pragelato (the ski jump stadium). What shocked us: parts of it are still in surprisingly good shape, even after nearly 20 years. And yet, they didn't reuse these sites. See more on YouTube: [https://youtu.be/jkMT1habyT8](https://youtu.be/jkMT1habyT8)",❄ Winter Olympics Throwback ❄,False,reddit.com
1r5rbag,Australia's first-ever Winter Olympic gold medal.,sco-go,SipsTea,44875,0.96,1446,1771192582.0,2026-02-15 21:56:22,https://v.redd.it/2wcodjfvcqjg1,https://www.reddit.com/r/SipsTea/comments/1r5rbag/australias_firstever_winter_olympic_gold_medal/,,Wait a damn minute!:Wayment:,False,v.redd.it
1r3nza0,Winter Olympics,Glad_Camel_6078,SipsTea,41357,0.96,1488,1770986015.0,2026-02-13 12:33:35,https://i.redd.it/m15a0dffa9jg1.png,https://www.reddit.com/r/SipsTea/comments/1r3nza0/winter_olympics/,,We have fun here :Peter:,False,i.redd.it
1qyenh2,Israeli team booed at 2026 Winter Olympics opening ceremony,Particular_Log_3594,TrendoraX,28091,0.9,2134,1770473158.0,2026-02-07 14:05:58,https://v.redd.it/nlsc5eaox2ig1,https://www.reddit.com/r/TrendoraX/comments/1qyenh2/israeli_team_booed_at_2026_winter_olympics/,,⚽ Sports ,False,v.redd.it
1qxwdan,"JD Vance gets ""a lot of boos"" during Winter Olympics opening ceremony",Prestigious-Toe7600,circled,36666,0.95,1764,1770417700.0,2026-02-06 22:41:40,https://i.redd.it/hcwhiedqcyhg1.jpeg,https://www.reddit.com/r/circled/comments/1qxwdan/jd_vance_gets_a_lot_of_boos_during_winter/,,💬 Opinion / Discussion,False,i.redd.it
1r3usa3,Condom shortage hits Winter Olympics as supplies vanish in just 3 days,joelman0,nottheonion,38633,0.93,1389,1771002382.0,2026-02-13 17:06:22,https://www.nbcboston.com/olympics/2026-milan-cortina/condom-shortage-hits-winter-olympics-supplies-vanish-3-days/3897660/,https://www.reddit.com/r/nottheonion/comments/1r3usa3/condom_shortage_hits_winter_olympics_as_supplies/,,,False,nbcboston.com
1qv3s5z,"A Chinese speed skater, Yang Jingru, executed a brilliant tactic to win gold in the 1500m at the 2024 Winter Youth Olympics.",jmike1256,nextfuckinglevel,21956,0.84,2186,1770151726.0,2026-02-03 20:48:46,https://v.redd.it/u1r3xg7vdchg1,https://www.reddit.com/r/nextfuckinglevel/comments/1qv3s5z/a_chinese_speed_skater_yang_jingru_executed_a/,,,False,v.redd.it
1qy13xt,NBC appears to cut crowd’s booing of JD Vance from Winter Olympics broadcast,biograf_,sports,41642,0.94,1343,1770429829.0,2026-02-07 02:03:49,https://www.theguardian.com/us-news/2026/feb/06/nbc-appears-to-cut-crowds-booing-of-jd-vance-from-winter-olympics-broadcast,https://www.reddit.com/r/sports/comments/1qy13xt/nbc_appears_to_cut_crowds_booing_of_jd_vance_from/,,:olympics: Olympics,False,theguardian.com
1qof12b,Italians furious over deployment of ICE agents to bolster US security at Winter Olympics,Rough_Tap9008,news,33023,0.96,1760,1769523400.0,2026-01-27 14:16:40,https://edition.cnn.com/2026/01/27/europe/italy-ice-agents-security-olympics-intl,https://www.reddit.com/r/news/comments/1qof12b/italians_furious_over_deployment_of_ice_agents_to/,,,False,edition.cnn.com
1qxm0mh,Winter Olympics Skier Gus Kenworthy Urinates “F*** ICE” In Snow,MarvelsGrantMan136,sports,66973,0.92,1065,1770394698.0,2026-02-06 16:18:18,https://deadline.com/2026/02/winter-olympics-gus-kenworthy-urinate-fuck-ice-1236711154/,https://www.reddit.com/r/sports/comments/1qxm0mh/winter_olympics_skier_gus_kenworthy_urinates_f/,,:olympics: Olympics,False,deadline.com
1qyi536,Israeli Olympic team booed at 2026 Winter Olympics opening ceremony,were_all_in_danger,Fauxmoi,35605,0.89,1032,1770481547.0,2026-02-07 16:25:47,https://v.redd.it/e6pmnsomm3ig1,https://www.reddit.com/r/Fauxmoi/comments/1qyi536/israeli_olympic_team_booed_at_2026_winter/,,APPROVED B-LISTERS,False,v.redd.it
1qy22f0,NBC appears to cut crowd’s booing of JD Vance from Winter Olympics broadcast,esporx,technology,38021,0.94,938,1770432483.0,2026-02-07 02:48:03,https://www.theguardian.com/us-news/2026/feb/06/nbc-appears-to-cut-crowds-booing-of-jd-vance-from-winter-olympics-broadcast,https://www.reddit.com/r/technology/comments/1qy22f0/nbc_appears_to_cut_crowds_booing_of_jd_vance_from/,,Networking/Telecom,False,theguardian.com
1qyf6g8,Strong backlash in Italy! The crowd booed JD Vance when his face appeared on the giant screens during the opening ceremony of the Winter Olympics in Milan. This moment makes it clear that many people do not want the Trump administration involved in this major sporting event.,MonitorVarious7608,circled,24312,0.94,1076,1770474513.0,2026-02-07 14:28:33,https://i.redd.it/ndtl7bsp13ig1.jpeg,https://www.reddit.com/r/circled/comments/1qyf6g8/strong_backlash_in_italy_the_crowd_booed_jd_vance/,,💬 Opinion / Discussion,False,i.redd.it
1qyd4ub,JD Vance and wife mercilessly booed at the 2026 Milan Winter Olympics opening ceremony in Italy,ControlCAD,videos,27981,0.92,1000,1770469048.0,2026-02-07 12:57:28,https://www.youtube.com/watch?v=0kfKBO9djD0,https://www.reddit.com/r/videos/comments/1qyd4ub/jd_vance_and_wife_mercilessly_booed_at_the_2026/,,,False,youtube.com
1qxx413,"Team USA, Vance Booed in Frosty Reception at Italy’s Winter Olympics",wsj,europe,31888,0.95,939,1770419471.0,2026-02-06 23:11:11,https://www.wsj.com/sports/olympics/team-usa-winter-olympics-31642142?st=8XZhXw&amp;mod=wsjreddit,https://www.reddit.com/r/europe/comments/1qxx413/team_usa_vance_booed_in_frosty_reception_at/,,News,False,wsj.com
1qwygdh,Food prices at the 2026 Winter Olympic games,chanashan,pics,12242,0.96,1866,1770327385.0,2026-02-05 21:36:25,https://i.redd.it/oh3qvg18wqhg1.jpeg,https://www.reddit.com/r/pics/comments/1qwygdh/food_prices_at_the_2026_winter_olympic_games/,,,False,i.redd.it
1qzowae,"Hunter Hess, a skier representing the USA in this year's Winter Olympics, who Trump called ""a real loser"", is a Bend native.",Altruistic-Form-3771,oregon,31506,0.95,884,1770594872.0,2026-02-08 23:54:32,https://www.reddit.com/gallery/1qzowae,https://www.reddit.com/r/oregon/comments/1qzowae/hunter_hess_a_skier_representing_the_usa_in_this/,"Let's give a big shoutout and round of applause for Hunter Hess here, as well as all our athletes from Oregon here.

A few days ago, two skiers from the US men's team, Hunter Hess and Chris Lillis, were interviewed about what they felt was going on the USA. Hess told reporters that he has ""mixed emotions"" about what is happening in the USA and the political climate, and both athletes spoke out against ICE. Both athletes in that interview made it very clear that people can still love their country, but be angry at the direction that the country and its government are headed. As a result, Orange Man took offense to this can publicly called Hess ""a real loser"" on social media.

I'm a person of color that lives in the Portland area, and Hunter Hess has far more in common with the average redneck outside the Willamette Valley than the average commuter in the Portland area. Yet Hess gave an incredibly professional sounding interview in front of a very international audience. Something that Trump could never do! To see the US president openly call an elite athlete from Oregon ""a real loser"" is absolutely despicable.",Trending,False,reddit.com
1r137ge,"TIL Canadians sent 5 tonnes of maple syrup to thank a Norwegian coach who gave a Canadian skier a spare pole after she broke hers mid-race, which led to Canada winning a silver medal at the 2006 Winter Olympics",planetcosmic,todayilearned,33021,0.97,805,1770736017.0,2026-02-10 15:06:57,https://www.cbc.ca/sports/norwegian-rewarded-for-olympic-sportsmanship-1.602311,https://www.reddit.com/r/todayilearned/comments/1r137ge/til_canadians_sent_5_tonnes_of_maple_syrup_to/,,,False,cbc.ca
1qokqyl,Italian centre-left politicians protested in the Lombardy regional council over reports that United States ICE agents could be involved in security for the upcoming Milan-Cortina Winter Olympics.,bordenman,UnderReportedNews,41043,0.97,826,1769535737.0,2026-01-27 17:42:17,https://v.redd.it/6fdiuaxzhxfg1,https://www.reddit.com/r/UnderReportedNews/comments/1qokqyl/italian_centreleft_politicians_protested_in_the/,[https://www.nbcnews.com/world/italy/ice-role-winter-olympics-prompts-fury-italy-rcna256087](https://www.nbcnews.com/world/italy/ice-role-winter-olympics-prompts-fury-italy-rcna256087),Europe / EU 🇪🇺,False,v.redd.it
1qyefiy,Israeli team booed at 2026 Winter Olympics opening ceremony,Particular_Log_3594,Knowledge_Community,8163,0.92,2111,1770472584.0,2026-02-07 13:56:24,https://v.redd.it/3b9s5gtyv2ig1,https://www.reddit.com/r/Knowledge_Community/comments/1qyefiy/israeli_team_booed_at_2026_winter_olympics/,,Video,False,v.redd.it
1r2o645,Winter Olympics 2026: Ukrainian athlete disqualified from skeleton over helmet tribute – live,Undefined_definition,europe,13792,0.96,924,1770885196.0,2026-02-12 08:33:16,https://www.theguardian.com/sport/live/2026/feb/12/winter-olympics-2026-day-six-live-action?CMP=Share_AndroidApp_Other,https://www.reddit.com/r/europe/comments/1r2o645/winter_olympics_2026_ukrainian_athlete/,,News,False,theguardian.com
1r3vnch,My grandmother has seen a little too much Winter Olympics,The_Chuckness88,funny,101189,0.96,527,1771004313.0,2026-02-13 17:38:33,https://v.redd.it/6ew1q9p2tajg1,https://www.reddit.com/r/funny/comments/1r3vnch/my_grandmother_has_seen_a_little_too_much_winter/,,,False,v.redd.it
1qxvn4f,US VP JD Vance getting booed during 2026 Winter Olympics opening ceremony,Yujin-Ha,popculturechat,33548,0.96,646,1770415975.0,2026-02-06 22:12:55,https://v.redd.it/29wdqufn7yhg1,https://www.reddit.com/r/popculturechat/comments/1qxvn4f/us_vp_jd_vance_getting_booed_during_2026_winter/,,Hot Topics 🚀,False,v.redd.it
1r5vqvs,JUST IN: Japanese freestyle skier Ikuma Horishima crosses finish line backwards at Winter Olympics,ShiroSara,sports,47296,0.97,530,1771204125.0,2026-02-16 01:08:45,https://v.redd.it/31or2iq7brjg1,https://www.reddit.com/r/sports/comments/1r5vqvs/just_in_japanese_freestyle_skier_ikuma_horishima/,,:ski: Skiing,False,v.redd.it
1qyfjoy,Israeli team booed at 2026 Winter Olympics opening ceremony,Particular_Log_3594,newsinterpretation,15220,0.96,818,1770475438.0,2026-02-07 14:43:58,https://v.redd.it/4s5jlvbg43ig1,https://www.reddit.com/r/newsinterpretation/comments/1qyfjoy/israeli_team_booed_at_2026_winter_olympics/,,,False,v.redd.it
1r3k7ie,Show this to anyone who says the Winter Olympics are boring,Limp-Helicopter-9682,sports,8898,0.88,1027,1770972636.0,2026-02-13 08:50:36,https://v.redd.it/btv8as7s68jg1,https://www.reddit.com/r/sports/comments/1r3k7ie/show_this_to_anyone_who_says_the_winter_olympics/,,:olympics: Olympics,False,v.redd.it
1qyrbsf,"Team USA figure skater Amber Glenn speaking at the 2026 Winter Olympics on the importance of using her platform to support the LGBTQ community under the Trump administration: I know a lot of people say you're just an athlete, like stick to your job. Shut up about politics, but politics affect us all",Yujin-Ha,sports,30230,0.9,511,1770502981.0,2026-02-07 22:23:01,https://v.redd.it/vszj6f6de5ig1,https://www.reddit.com/r/sports/comments/1qyrbsf/team_usa_figure_skater_amber_glenn_speaking_at/,,:olympics: Olympics,False,v.redd.it
1qt8el8,Anger is mounting in Italy over ICE presence at the Winter Olympics.,Mental_Pea9125,ProgressiveHQ,11183,0.99,787,1769974779.0,2026-02-01 19:39:39,https://v.redd.it/ernsidoqrxgg1,https://www.reddit.com/r/ProgressiveHQ/comments/1qt8el8/anger_is_mounting_in_italy_over_ice_presence_at/,,Protest,False,v.redd.it
1r4mqgt,OC: Brazilian skier celebrates winning first Winter Olympic medal for South America,nbcnews,pics,25628,0.98,468,1771081187.0,2026-02-14 14:59:47,https://www.reddit.com/gallery/1r4mqgt,https://www.reddit.com/r/pics/comments/1r4mqgt/oc_brazilian_skier_celebrates_winning_first/,,,False,reddit.com
1r2o3d3,Ukraine's Vladyslav Heraskevych out of Winter Olympics over banned helmet honoring war dead,TheGreatDomilies,sports,11617,0.96,634,1770884904.0,2026-02-12 08:28:24,https://apnews.com/article/heraskevych-helmet-ukraine-olympics-skeleton-9f304e1ff834ddab33af2f4e003f04a8,https://www.reddit.com/r/sports/comments/1r2o3d3/ukraines_vladyslav_heraskevych_out_of_winter/,,:olympics: Olympics,False,apnews.com
1r1u1be,"we need to start calling winter olympics medals participation trophies for rich europeans, they're not real sports like the summer olympics",SIIP00,ShitAmericansSay,7677,0.98,825,1770806368.0,2026-02-11 10:39:28,https://i.redd.it/kgnwf2lhguig1.jpeg,https://www.reddit.com/r/ShitAmericansSay/comments/1r1u1be/we_need_to_start_calling_winter_olympics_medals/,,Europe,False,i.redd.it
1r8slhi,Canada at the Winter Olympics,Nviewx,WinterOlympics2026,14061,0.97,466,1771485153.0,2026-02-19 07:12:33,https://v.redd.it/dol3yix4iekg1,https://www.reddit.com/r/WinterOlympics2026/comments/1r8slhi/canada_at_the_winter_olympics/,"Everybody, Everybody.. Coming for Everybody ",,False,v.redd.it
1r9wkgp,"Today, Norway made history, securing 17 gold medals in a single Winter Olympics",sabelsvans,olympics,8830,0.98,580,1771597136.0,2026-02-20 14:18:56,https://i.redd.it/ns32i9murnkg1.jpeg,https://www.reddit.com/r/olympics/comments/1r9wkgp/today_norway_made_history_securing_17_gold_medals/,"Johannes Dale-Skjevdal delivered a perfect 20 for 20 on the shooting range in toady 15 km mass start biathlon, a flawless performance that sealed Norway’s 17th gold medal of the Games.

With that, Norway surpassed its own record of 16 gold medals set at the Beijing 2022 Winter Olympics, setting a new benchmark in Winter Olympic history 🥳🍾🍻🥂",❄ Milano-Cortina 2026 (General Discussion) ❄,False,i.redd.it
1qoeiei,ICE agents to help with security at Winter Olympics,AccurateSource2,nottheonion,7190,0.95,873,1769522185.0,2026-01-27 13:56:25,https://www.straitstimes.com/world/europe/ice-agents-to-help-with-security-at-winter-olympics,https://www.reddit.com/r/nottheonion/comments/1qoeiei/ice_agents_to_help_with_security_at_winter/,,,False,straitstimes.com
1qxv667,British-American Winter Olympic Skier Gus Kenworthy Pissed FUCK ICE in the Snow,QuicklyThisWay,chaoticgood,18626,0.95,426,1770414872.0,2026-02-06 21:54:32,https://i.redd.it/7jtg4avs3yhg1.jpeg,https://www.reddit.com/r/chaoticgood/comments/1qxv667/britishamerican_winter_olympic_skier_gus/,"**Team GB skier Gus Kenworthy will not be punished after appearing to urinate a graphic message about the United States' immigration and customs enforcement (ICE) in the snow, then posting a photograph of it online. -** [https://www.bbc.com/sport/articles/cew8wk7ygwno](https://www.bbc.com/sport/articles/cew8wk7ygwno)   
Archive: [https://web.archive.org/web/20260206215310/https://www.bbc.com/sport/articles/cew8wk7ygwno](https://web.archive.org/web/20260206215310/https://www.bbc.com/sport/articles/cew8wk7ygwno)",Current Events,False,i.redd.it
1qyam22,NBC appears to cut crowd’s booing of JD Vance from Winter Olympics broadcast | Winter Olympics,WF-2,news,12977,0.97,434,1770460650.0,2026-02-07 10:37:30,https://www.theguardian.com/us-news/2026/feb/06/nbc-appears-to-cut-crowds-booing-of-jd-vance-from-winter-olympics-broadcast,https://www.reddit.com/r/news/comments/1qyam22/nbc_appears_to_cut_crowds_booing_of_jd_vance_from/,,,False,theguardian.com
1qye89g,dramatic arrival of the Olympic rings at the 2026 Winter Olympics Opening Ceremony,Obvious_Shoe7302,Damnthatsinteresting,15319,0.93,404,1770472040.0,2026-02-07 13:47:20,https://v.redd.it/uxo9oev7u2ig1,https://www.reddit.com/r/Damnthatsinteresting/comments/1qye89g/dramatic_arrival_of_the_olympic_rings_at_the_2026/,,Video,False,v.redd.it
1r0w64g,"The angle of the track for the sliding sports event (bobsled, luge, and skeleton) at the winter Olympics",Hypnoidz,interestingasfuck,17886,0.99,350,1770715333.0,2026-02-10 09:22:13,https://v.redd.it/md7alcjsxmig1,https://www.reddit.com/r/interestingasfuck/comments/1r0w64g/the_angle_of_the_track_for_the_sliding_sports/,,,False,v.redd.it
1qmnz4y,Connor and Hudson with the Winter Olympic 2026 torches images are out,ivan_luck,heatedrivalry,16789,0.96,390,1769359084.0,2026-01-25 16:38:04,https://i.redd.it/b1av6j0zwifg1.jpeg,https://www.reddit.com/r/heatedrivalry/comments/1qmnz4y/connor_and_hudson_with_the_winter_olympic_2026/,Source: https://www.instagram.com/p/DT8LGIbkZ-n/?img\_index=1&amp;igsh=MXJ5Y2VubGg4NWZzaw== igsh=M3p5djgxejQwbDJz,SOCIAL MEDIA 📸,False,i.redd.it
1r9wum4,"Kash Patel takes '$75,000 FBI jet flight' to see Winter Olympics sport he loves",TheMirrorUS,FBI,15835,0.98,324,1771597825.0,2026-02-20 14:30:25,https://www.themirror.com/sport/ice-hockey/kash-patel-winter-olymics-hockey-1694132,https://www.reddit.com/r/FBI/comments/1r9wum4/kash_patel_takes_75000_fbi_jet_flight_to_see/,,News,False,themirror.com
1qxvjqg,"JD Vance gets ""a lot of boos"" during Winter Olympics opening ceremony",ansyhrrian,politics,21279,0.98,329,1770415746.0,2026-02-06 22:09:06,https://www.newsweek.com/jd-vance-booed-olympics-opening-ceremony-11481402,https://www.reddit.com/r/politics/comments/1qxvjqg/jd_vance_gets_a_lot_of_boos_during_winter/,,No Paywall,False,newsweek.com
1qoeqxa,Milan Mayor Slams U.S. ICE Role at 2026 Winter Olympics,Memes_FoIder,UnderReportedNews,20776,0.98,344,1769522732.0,2026-01-27 14:05:32,https://i.redd.it/qgsnjoqkfwfg1.jpeg,https://www.reddit.com/r/UnderReportedNews/comments/1qoeqxa/milan_mayor_slams_us_ice_role_at_2026_winter/,,ICE / DHS 🧊,False,i.redd.it
1r7tz3c,In honor of the Winter Olympics: Who remembers this fiasco?,RealPlanC,90s,6126,0.95,525,1771390946.0,2026-02-18 05:02:26,https://i.redd.it/wwarc0qqq6kg1.jpeg,https://www.reddit.com/r/90s/comments/1r7tz3c/in_honor_of_the_winter_olympics_who_remembers/,It has been 32 years since the whole Nancy Kerrigan and Tonya Harding incident. ,:90s: Discussion,False,i.redd.it
1ra84wr,"After delivering an exuberant performance at the 2026 Winter Olympics, Alysa Liu skated off the ice shouting, ""that's what I'm fucking talking about!"" on live TV — minutes later, she was crowned champion. It's the first time in 24 years a U.S. athlete has triumphed in this event.",Huzaifa_Haroon,Fauxmoi,18174,0.95,297,1771622958.0,2026-02-20 21:29:18,https://v.redd.it/35l9m7m9vpkg1,https://www.reddit.com/r/Fauxmoi/comments/1ra84wr/after_delivering_an_exuberant_performance_at_the/,,SPORTS SECTION,False,v.redd.it
1qy61pv,To be well-received at the 2026 Winter Olympics,AbeFromanSassageKing,therewasanattempt,13920,0.94,347,1770444287.0,2026-02-07 06:04:47,https://v.redd.it/m2sw0f8uj0ig1,https://www.reddit.com/r/therewasanattempt/comments/1qy61pv/to_be_wellreceived_at_the_2026_winter_olympics/,,,False,v.redd.it
1qzdph9,Team Mongolias winter olympics outfits,MambaMentality24x2,BeAmazed,36840,0.98,269,1770568880.0,2026-02-08 16:41:20,https://www.reddit.com/gallery/1qzdph9,https://www.reddit.com/r/BeAmazed/comments/1qzdph9/team_mongolias_winter_olympics_outfits/,,Miscellaneous / Others,False,reddit.com
1r4xud7,Number of Medals Won at the Winter Olympics All Time in the Americas,Fluid-Decision6262,MapPorn,6820,0.97,421,1771108027.0,2026-02-14 22:27:07,https://i.redd.it/qmysog9hdjjg1.jpeg,https://www.reddit.com/r/MapPorn/comments/1r4xud7/number_of_medals_won_at_the_winter_olympics_all/,,,False,i.redd.it
