id,title,author,subreddit,score,upvote_ratio,num_comments,created_utc,created_date,url,permalink,selftext,link_flair_text,is_self,domain
1qxo3rg,Winter Olympics Skier &amp; ‘American Horror Story’ Star Gus Kenworthy Urinates “F*** ICE” In Snow,DemiFiendRSA,entertainment,4473,0.98,98,1770399196.0,2026-02-06 17:33:16,https://deadline.com/2026/02/winter-olympics-gus-kenworthy-urinate-fuck-ice-1236711154,https://www.reddit.com/r/entertainment/comments/1qxo3rg/winter_olympics_skier_american_horror_story_star/,,,False,deadline.com
1r5lo9u,🇯🇵 freestyle skier Ikuma crosses finish line backwards at Winter Olympics 🤯,Admirable121,olympics,3685,1.0,105,1771179349.0,2026-02-15 18:15:49,https://v.redd.it/avt35aaj8pjg1,https://www.reddit.com/r/olympics/comments/1r5lo9u/freestyle_skier_ikuma_crosses_finish_line/,,❄ Milano-Cortina 2026 (Video) ❄,False,v.redd.it
1r88u73,Anon talks about the Winter Olympics,DillyDillySzn,4chan,2826,0.98,121,1771434628.0,2026-02-18 17:10:28,https://i.redd.it/f28szjomcakg1.jpeg,https://www.reddit.com/r/4chan/comments/1r88u73/anon_talks_about_the_winter_olympics/,,,False,i.redd.it
1qyw1m3,"U.S. Olympic ice dancer Madison Chock designs many of her costumes, including her rhythm and free dance outfits at the Milan Cortina Winter Olympics. She also designed the free dance costume for her husband/partner, Evan Bates, as well as those for the Spanish &amp; Georgian teams (February 6-7, 2026)",skermahger,whatthefrockk,3426,0.98,106,1770515427.0,2026-02-08 01:50:27,https://www.reddit.com/gallery/1qyw1m3,https://www.reddit.com/r/whatthefrockk/comments/1qyw1m3/us_olympic_ice_dancer_madison_chock_designs_many/,"Chock on the inspiration for her rhythm costume: ""Our music is Lenny Kravitz, and the theme of the rhythm dance this year is the ’90s. I wanted to incorporate the nostalgia of that decade with some animal prints, and some chains inspired by Chanel’s runway shows at the time. And there’s also a bit of Lenny’s style, too. He’s a fashion icon. I studied his stage looks, his streetwear, and pulled together something for Evan that was inspired really by one particular outfit that Lenny himself wore. My look, too, has some Lenny also, especially with mesh–he wore a lot of mesh.”

Chock on the inspiration for the free dance costumes: “We have a *flamenco*\-inspired program, so for the costumes we worked with a specialist who is a choreographer and director of the Spanish National Ballet.” (Source: [Vogue)](https://www.vogue.com/article/madison-chock-and-evan-bates-ice-dancers-interview)",Sports &amp; Athletics 🏀 🏈⚽️🎾🏒,False,reddit.com
1r9lx67,The gold of the Milano Cortina 2026 Winter Olympics gives you wings!,Ok-Channel-8775,WinterOlympics2026,6218,0.98,69,1771562408.0,2026-02-20 04:40:08,https://i.redd.it/vd3qfodkwkkg1.jpeg,https://www.reddit.com/r/WinterOlympics2026/comments/1r9lx67/the_gold_of_the_milano_cortina_2026_winter/,,,False,i.redd.it
1r5rbc4,Australia's first-ever Winter Olympic gold medal.,sco-go,Amazing,2031,0.97,148,1771192585.0,2026-02-15 21:56:25,https://v.redd.it/ost2d7qscqjg1,https://www.reddit.com/r/Amazing/comments/1r5rbc4/australias_firstever_winter_olympic_gold_medal/,,Interesting 🤔,False,v.redd.it
1r5nfjz,"Italy breaks its record: most medals won in Winter Olympics, total 22!",MinaCiclamina,olympics,2765,0.99,108,1771183412.0,2026-02-15 19:23:32,https://i.redd.it/onw5bnumlpjg1.jpeg,https://www.reddit.com/r/olympics/comments/1r5nfjz/italy_breaks_its_record_most_medals_won_in_winter/,,❄ Milano-Cortina 2026 (General Discussion) ❄,False,i.redd.it
1qv9zft,"Team Mongolia will be wearing custom-made kits by Goyol Cashmere for their ceremonial and casual outfits at the Milano–Cortina 2026 Winter Olympic Games. ""This collection aims to reintroduce the ancient Mongolian clothing culture to the contemporary world and share it on a global stage.""",Murky_Chemical891,whatthefrockk,3811,1.0,90,1770166362.0,2026-02-04 00:52:42,https://www.reddit.com/gallery/1qv9zft,https://www.reddit.com/r/whatthefrockk/comments/1qv9zft/team_mongolia_will_be_wearing_custommade_kits_by/,"From the brands instagram: 

Drawing inspiration from the attire of the Great Mongol Empire of the 13th–15th centuries, one of the most powerful periods in our nation’s history, the designs preserve essential traditional elements such as a functional skirt slit that allows freedom of movement, a raised collar that protects against wind and cold, and a fully closed overlapping front symbolizing warmth and unity. Finest Mongolian cashmere is elegantly finished with silk trimming, embroidered with traditional horn motifs, infusing the garments with a refined ceremonial character.  
  
Using Mongolian cashmere—long relied upon by our nomadic people to endure harsh winters—we have created ceremonial deels that honor traditional history and culture, alongside premium cashmere knit casual ensembles inspired by alpine ski sweaters rooted in Western mountain culture, enriched with motifs of the Mongolian ger and nomadic life.  
  
Through these designs, we proudly present to the global sporting stage the resilience, wisdom, and warrior spirit forged over thousands of years by Mongolians who have endured the eternal winters of the Central Asian highlands.",Sports &amp; Athletics 🏀 🏈⚽️🎾🏒,False,reddit.com
1r77yjl,Klopp ringing the bell for the last lap in the Winter Olympics Men's 4x7.5km Relay Biathlon🤩,KassupojuFIN,LiverpoolFC,3793,0.99,82,1771339696.0,2026-02-17 14:48:16,https://i.redd.it/0evjvbjci2kg1.jpeg,https://www.reddit.com/r/LiverpoolFC/comments/1r77yjl/klopp_ringing_the_bell_for_the_last_lap_in_the/,My guy is just completing side quests at this point😂,Klopp♥️,False,i.redd.it
1qeni7f,Winter Olympics Jumpscare,MelonTheSprigatito,tumblr,4825,1.0,83,1768587018.0,2026-01-16 18:10:18,https://i.redd.it/tqtiz6h25rdg1.jpeg,https://www.reddit.com/r/tumblr/comments/1qeni7f/winter_olympics_jumpscare/,,I gotta play Mario and Sonic At The Olympic Winter Games DS rn,False,i.redd.it
1ra98pf,"After delivering an exuberant performance at the 2026 Winter Olympics, Alysa Liu skated off the ice shouting, ""that's what I'm fucking talking about!"" on live TV — minutes later, she was crowned champion. It's the first time in 24 years a U.S. athlete has triumphed in this event.",PTechNM,MadeMeSmile,2229,0.94,120,1771625538.0,2026-02-20 22:12:18,https://v.redd.it/35l9m7m9vpkg1,https://www.reddit.com/r/MadeMeSmile/comments/1ra98pf/after_delivering_an_exuberant_performance_at_the/,,,False,v.redd.it
1q30jb4,Expel USA from the Winter Olympic Games,UpthefuckingTics,BoycottUnitedStates,2488,0.96,139,1767461473.0,2026-01-03 17:31:13,https://www.reddit.com/r/BoycottUnitedStates/comments/1q30jb4/expel_usa_from_the_winter_olympic_games/,https://www.reddit.com/r/BoycottUnitedStates/comments/1q30jb4/expel_usa_from_the_winter_olympic_games/,"The illegal military operation in Venezuela calls for a swift response from the civilized world. Russia was banned for invading Ukraine, therefore USA should be banned for invading Venezuela. Let’s get it done. Now. ",,True,self.BoycottUnitedStates
1qyzxri,Can't be the Winter Olympics without this gem.,Naive_Establishment2,90s,3074,0.99,97,1770526715.0,2026-02-08 04:58:35,https://i.redd.it/6lvofnsxc7ig1.jpeg,https://www.reddit.com/r/90s/comments/1qyzxri/cant_be_the_winter_olympics_without_this_gem/,,:photo: Photo,False,i.redd.it
1qy4mk2,The entire stadium just erupted in whistles and boos for Israel at the winter Olympics.,helltrooper61,sportsgossips,749,0.8,449,1770439879.0,2026-02-07 04:51:19,https://v.redd.it/a78yu96q60ig1,https://www.reddit.com/r/sportsgossips/comments/1qy4mk2/the_entire_stadium_just_erupted_in_whistles_and/,,Highlight,False,v.redd.it
1qwi3fo,Jack Innanen calls out Tate McRae for promoting Team USA at the Winter Olympics,IfatallyflawedI,popculturechat,1264,0.91,223,1770288438.0,2026-02-05 10:47:18,https://v.redd.it/lny9f2leonhg1,https://www.reddit.com/r/popculturechat/comments/1qwi3fo/jack_innanen_calls_out_tate_mcrae_for_promoting/,"As someone who is not living in the North American continent, it’s still so embarrassing that she decided to put out promotional material for a country that’s been threatening to annex your country as a “51st state” ",Guest List Only ⭐️,False,v.redd.it
1r4nrty,Brazilian athlete wins South America's first gold medal (and first medal ever) at the Winter Olympics,peregrinodossonhos,news,2568,0.97,104,1771083699.0,2026-02-14 15:41:39,https://www.nbcnews.com/sports/olympics/2026-winter-olympics-two-athletes-deliver-south-americas-first-medals-rcna258896,https://www.reddit.com/r/news/comments/1r4nrty/brazilian_athlete_wins_south_americas_first_gold/,,,False,nbcnews.com
1r37t8r,"US lawyer who competes in Winter Olympics goes off on ICE actions in Minnesota: ""What's happening in Minnesota is wrong. There's no shades of grey. It's clear.""",NoMortgage4247,stpaul,767,0.77,389,1770935855.0,2026-02-12 22:37:35,https://i.redd.it/bsk5vkdh55jg1.jpeg,https://www.reddit.com/r/stpaul/comments/1r37t8r/us_lawyer_who_competes_in_winter_olympics_goes/,,Minnesota Related,False,i.redd.it
1qxwwcd,"Team USA freestyle skier Hunter Hess, during the Winter Olympics, speaks on ICE agents’ actions: “Just because I wear the flag doesn’t mean I represent everything that’s going on in the U.S.”",CorleoneBaloney,popculturechat,3523,0.99,85,1770418958.0,2026-02-06 23:02:38,https://v.redd.it/u3ptqkiigyhg1,https://www.reddit.com/r/popculturechat/comments/1qxwwcd/team_usa_freestyle_skier_hunter_hess_during_the/,,Guest List Only TW ⚠️,False,v.redd.it
1qxycgl,Vice President JD Vance left red-faced as he's BOOED at Winter Olympics opening ceremony,IrishStarUS,AntiTrumpAlliance,2424,0.99,109,1770422539.0,2026-02-07 00:02:19,https://www.irishstar.com/news/us-news/vice-president-jd-vance-left-36684689,https://www.reddit.com/r/AntiTrumpAlliance/comments/1qxycgl/vice_president_jd_vance_left_redfaced_as_hes/,,,False,irishstar.com
1qxjlyl,Winter Olympics Team GB skier targets ICE with graphic message written in snow,ElonDoneABellamy,unitedkingdom,824,0.88,349,1770389377.0,2026-02-06 14:49:37,https://www.theguardian.com/sport/2026/feb/06/team-gb-winter-olympic-skier-gus-kenworthy-targets-ice-graphic-message-in-snow,https://www.reddit.com/r/unitedkingdom/comments/1qxjlyl/winter_olympics_team_gb_skier_targets_ice_with/,,,False,theguardian.com
1r6r1dg,"RTS, the public TV of french-speaking Switzerland, narrates the bobsled run at Winter Olympics 2026",zzztz,Palestine,3294,0.99,79,1771288008.0,2026-02-17 00:26:48,https://v.redd.it/m6r4gv718yjg1,https://www.reddit.com/r/Palestine/comments/1r6r1dg/rts_the_public_tv_of_frenchspeaking_switzerland/,,Solidarity &amp; Activism,False,v.redd.it
1r5cggb,How are you guys so good in Winter Olympics,AgitatedResearch,AskAnAustralian,555,0.93,550,1771155190.0,2026-02-15 11:33:10,https://www.reddit.com/r/AskAnAustralian/comments/1r5cggb/how_are_you_guys_so_good_in_winter_olympics/,https://www.reddit.com/r/AskAnAustralian/comments/1r5cggb/how_are_you_guys_so_good_in_winter_olympics/,"As someone outside of Australia, I am very impressed by the good results you get in the Olympics.

How do you explain these good results. I was taken aback as I expected there is little snow even in the mountains, but maybe I am wrong. ",,True,self.AskAnAustralian
1qob7wd,"Breaking via Associated Press: ICE Agents Will Be Deployed in Milan, Italy for the Winter Olympics Security Detail.  There should be a ban of ICE Agents in the Schengen Area",RidetheSchlange,BoycottUnitedStates,1076,0.98,237,1769512982.0,2026-01-27 11:23:02,https://i.redd.it/w1drnbk5mvfg1.png,https://www.reddit.com/r/BoycottUnitedStates/comments/1qob7wd/breaking_via_associated_press_ice_agents_will_be/,"This is absolutely unacceptable and must be addressed with rhe politicians of your country ASAP.

  
[https://apnews.com/article/ice-milan-cortina-olympics-immigration-enforcement-us-110fa4b2066e1fb920dba2a71c3a89e0](https://apnews.com/article/ice-milan-cortina-olympics-immigration-enforcement-us-110fa4b2066e1fb920dba2a71c3a89e0)

Note: this is now being confirmed by AFP, DPA, and news agencies worldwide",,False,i.redd.it
1qzn6bf,Protest Erupt in Italy against the Winter Olympics,Greylunes1,ExploreFortMyers,2490,0.99,97,1770590279.0,2026-02-08 22:37:59,https://v.redd.it/gqga1pfxlcig1,https://www.reddit.com/r/ExploreFortMyers/comments/1qzn6bf/protest_erupt_in_italy_against_the_winter_olympics/,,World events  🌎,False,v.redd.it
1r8ciri,"Good boi husky races with the cross-country skiers at Winter Olympics, loses but steals the show",shhhhh_h,popculturechat,2034,0.98,107,1771442521.0,2026-02-18 19:22:01,https://v.redd.it/bdurec6zzakg1,https://www.reddit.com/r/popculturechat/comments/1r8ciri/good_boi_husky_races_with_the_crosscountry_skiers/,,Sports Section 🏈⚽️,False,v.redd.it
1r7vqub,"Countries that have won gold medals in Summer Olympics, Winter Olympics or both",OppositeRock4217,MapPorn,1541,0.97,135,1771396810.0,2026-02-18 06:40:10,https://i.redd.it/pzr874n387kg1.png,https://www.reddit.com/r/MapPorn/comments/1r7vqub/countries_that_have_won_gold_medals_in_summer/,,,False,i.redd.it
1qypzjj,"Kevin Aymoz (🇫🇷) skating to Gaga’s ""Judas"" tonight at the 2026 Winter Olympics ⛸️🔥",Other-Asparagus01,LadyGaga,2950,0.99,80,1770499698.0,2026-02-07 21:28:18,https://v.redd.it/a9ic89rl45ig1,https://www.reddit.com/r/LadyGaga/comments/1qypzjj/kevin_aymoz_skating_to_gagas_judas_tonight_at_the/,,Social Media,False,v.redd.it
1r89egp,Volunteers have invented a new Winter Olympic sport,Shroft,olympics,3201,0.99,68,1771435819.0,2026-02-18 17:30:19,https://v.redd.it/lcpl7ct5gakg1,https://www.reddit.com/r/olympics/comments/1r89egp/volunteers_have_invented_a_new_winter_olympic/,,❄ Milano-Cortina 2026 (Video) ❄,False,v.redd.it
1qy4fsb,Malaysia’s official attire for the Winter Olympics,UsernameGenerik,malaysia,1250,0.98,162,1770439310.0,2026-02-07 04:41:50,https://www.reddit.com/gallery/1qy4fsb,https://www.reddit.com/r/malaysia/comments/1qy4fsb/malaysias_official_attire_for_the_winter_olympics/,,Sports,False,reddit.com
1qyepnz,Israeli team booed at 2026 Winter Olympics opening ceremony,Particular_Log_3594,Global_News_Hub,2201,0.98,93,1770473316.0,2026-02-07 14:08:36,https://v.redd.it/h3fdp675y2ig1,https://www.reddit.com/r/Global_News_Hub/comments/1qyepnz/israeli_team_booed_at_2026_winter_olympics/,,:region_white_isrpal: Israel/Palestine,False,v.redd.it
1qxn9us,Haiti’s Winter Olympics Uniforms,Jetamors,blackladies,3034,1.0,71,1770397409.0,2026-02-06 17:03:29,https://www.reddit.com/gallery/1qxn9us,https://www.reddit.com/r/blackladies/comments/1qxn9us/haitis_winter_olympics_uniforms/,"Pics taken from [the designer's Instagram](https://www.instagram.com/p/DUWDXwMiGmm/) (Stella Jean).

&gt; From the highest peaks of the Caribbean to the heart of the Dolomites.  

&gt; Haiti makes its debut at [@milanocortina2026](https://www.instagram.com/milanocortina2026/) 2026 with Richi Viano and Stevenson Savart.Two athletes.One nation that refuses to disappear.

&gt; These uniforms are not an exercise in style.They are an act of responsibility.Every detail is intentional.Every centimeter of fabric carries the duty to tell a story — and the will to endure.

&gt; Made in Italy.Crafted by former ski champion Pietro Vitalini.The only hand-painted uniforms at the Games,inspired by the visionary art of Edouard Duval-Carrié.

&gt; What you see is not decoration.It is visibility as a form of survival.

For a bit more context, there's a nice article from [here](https://haitiantimes.com/2026/02/03/haiti-winter-olympics-milan-cortina-uniforms/) about the designer and team, and [here](https://www.essence.com/news/haiti-winter-olympics-uniforms/) focusing more on the designer. Originally the design was going to include Toussaint Louverture, but apparently that was ""too political"" for the IOC 🙄",Media &amp; Entertainment 🍿🎶,False,reddit.com
1qytgdk,"Lindsey Vonn, an American skier, tore her ACL a week before the winter Olympics but is still competing",Cautious_Ad_3918,BeAmazed,916,0.83,221,1770508417.0,2026-02-07 23:53:37,https://i.redd.it/dk92a4wiu5ig1.jpeg,https://www.reddit.com/r/BeAmazed/comments/1qytgdk/lindsey_vonn_an_american_skier_tore_her_acl_a/,,Sports,False,i.redd.it
1r5slqe,Putin pretends to sleep during Ukraines 2022 Winter Olympics opening. The russian invasion will start just a few days after.,GreenEyeOfADemon,ukraine,3007,0.99,67,1771195773.0,2026-02-15 22:49:33,https://v.redd.it/3hd6e1qdmqjg1,https://www.reddit.com/r/ukraine/comments/1r5slqe/putin_pretends_to_sleep_during_ukraines_2022/,,WAR,False,v.redd.it
1r0qfvz,"Dhurandhar fever reaches 2026 Winter Olympics in Italy. Russian figure skater Anastasiia Gubanova performed a routine sporting a red bindi, blending Indian culture and music with the sport ❤️",Main_Pay_9669,Dhurandhar,3166,0.93,65,1770695795.0,2026-02-10 03:56:35,https://v.redd.it/j31fzoyoblig1,https://www.reddit.com/r/Dhurandhar/comments/1r0qfvz/dhurandhar_fever_reaches_2026_winter_olympics_in/,,,False,v.redd.it
1qlte3e,[@milanocortina26] Kimi Antonelli running the 2026 Winter Olympics torch relay today,Travelhog416,formula1,7533,0.99,41,1769276499.0,2026-01-24 17:41:39,https://i.imgur.com/9X7fvs1.jpeg,https://www.reddit.com/r/formula1/comments/1qlte3e/milanocortina26_kimi_antonelli_running_the_2026/,,:post-social-media: Social Media,False,i.imgur.com
1qyavnv,Best friends genocidal Israel and the fascist United States are booed by the entire stadium at the opening of the Winter Olympics.,GerryAdamsSon,suppressed_news,2334,0.99,83,1770461627.0,2026-02-07 10:53:47,https://v.redd.it/447muxkbz1ig1,https://www.reddit.com/r/suppressed_news/comments/1qyavnv/best_friends_genocidal_israel_and_the_fascist/,,United States Empire 🇺🇸,False,v.redd.it
1qmnsd2,Hudson Williams and Connor Storrie at today’s Winter Olympic torch relay,lawrencedun2002,Fauxmoi,2225,0.94,90,1769358671.0,2026-01-25 16:31:11,https://v.redd.it/3if007xpvifg1,https://www.reddit.com/r/Fauxmoi/comments/1qmnsd2/hudson_williams_and_connor_storrie_at_todays/,,SPORTS SECTION,False,v.redd.it
1r4hjel,Sweden accused Canada of cheating in the Curling at the Winter Olympics...here's the all important moment.,JOE_Media,MilanOlympics,694,0.9,265,1771065613.0,2026-02-14 10:40:13,https://i.redd.it/11j2keqjufjg1.jpeg,https://www.reddit.com/r/MilanOlympics/comments/1r4hjel/sweden_accused_canada_of_cheating_in_the_curling/,"Curling tends to be one of the slower-paced sports at the winter games, however, tensions hit fever pitch last night when Sweden accused Canada of cheating.

The Swedish men were unhappy with their Canadian counterparts, claiming they were 'double-touching' stones.

The Swedes raised the issue multiple times with officials to the annoyance of Canadian Marc Kennedy who then accused the Swedish of doing the same and shouted: “I haven’t done it once. You can f\*\*k off!

“I can show you the video after the game.”

Well, here it is...you can draw your own conclusions.

There is no evidence of Sweden doing the same.

  
",,False,i.redd.it
1r4smr4,Canada’s curling war of words with Sweden escalates after warning over ‘F-bomb’ | Winter Olympics 2026,YesNo_Maybe_,sports,848,0.93,206,1771095150.0,2026-02-14 18:52:30,https://www.theguardian.com/sport/2026/feb/14/winter-olympics-canada-warned-after-curling-f-bomb-sparks-emergency-spot-checks,https://www.reddit.com/r/sports/comments/1r4smr4/canadas_curling_war_of_words_with_sweden/,,:olympics: Olympics,False,theguardian.com
1ra8zc9,"""That's what I'm fucking talking about!"" — racoon girl Alysa Liu after delivering an exuberant performance that won her a gold medal at the 2026 Winter Olympics.",Huzaifa_Haroon,popculturechat,2553,0.96,66,1771624937.0,2026-02-20 22:02:17,https://v.redd.it/0588mfbi2qkg1,https://www.reddit.com/r/popculturechat/comments/1ra8zc9/thats_what_im_fucking_talking_about_racoon_girl/,,Sports Section 🏈⚽️,False,v.redd.it
1r9n1rf,My BF ruined the Winter Olympics,autumniam,TwoHotTakes,1263,0.92,121,1771565952.0,2026-02-20 05:39:12,https://www.reddit.com/r/TwoHotTakes/comments/1r9n1rf/my_bf_ruined_the_winter_olympics/,https://www.reddit.com/r/TwoHotTakes/comments/1r9n1rf/my_bf_ruined_the_winter_olympics/,"I love watching the Winter Olympics-specifically figure skating. I’m forty years which means there have been ten of them since I’ve been alive! My mom and I always set aside time to snuggle up and watch figure skating together when I was a kid. Even after I moved out we would still text about it! 

This current Winter Olympics I have been more invested than usual. Subscribing to YouTube figure skating channels well before the Olympics were beginning. I was very excited for this years program! I’m a Musial theatre nerd and love all the pageantry and story telling. 

Some background: my ex husband and I got in a fight during Winter Olympics because I asked him to watch figure skating with me; he essentially told me it was dumb and he would not be watching it with me since it wasn’t his thing. Fun fact we had room mates at the time who were super into hockey and he didn’t hesitate to watch with them despite no prior interest in hockey or any sport at all. 

Forward to today: I’ve been with my partner for almost five years now. We live together. I’ve been waking up early everyday for almost two weeks to watch the figure skating events live. I couldn’t do that today because I had a virtual job interview. So I made sure to plan on watching the replay later this evening. 

As I was watching this replay he walked in and told me who won the gold medal. He shrugged it off since of course he knew since he was always betting money on sports. (I asked him a few days ago if people bet on the Olympics and he said yeah but not me I don’t have any money!) He is a big NFL fan and does fantasy football-so it’s not like he’s ignorant to the process. 

So; the Olympic figure skaters was down to the last three of the event. I was on the edge of my seat. I had an idea of who I wanted to win. And he casually walks in and says oh yeah; she won! I told him to leave the room and that spoilers are a deal breaker for me. He hasn’t come out of his room since. 

I guess I can try again in four years. . . ",Listener Write In,True,self.TwoHotTakes
1qoll1r,Italian centre-left politicians protested in the Lombardy regional council over reports that United States ICE agents could be involved in security for the upcoming Milan-Cortina Winter Olympics.,JeanJauresJr,PublicFreakout,2911,0.99,64,1769537428.0,2026-01-27 18:10:28,https://v.redd.it/z82ny9b9nxfg1,https://www.reddit.com/r/PublicFreakout/comments/1qoll1r/italian_centreleft_politicians_protested_in_the/,,🖕 🧊 Freakout,False,v.redd.it
1r14hgn,I just wanted a chance to compete in the Winter Olympics.,Excellent_1918,HumansInMyHouse,4279,1.0,44,1770738853.0,2026-02-10 15:54:13,https://v.redd.it/vac41rs27oig1,https://www.reddit.com/r/HumansInMyHouse/comments/1r14hgn/i_just_wanted_a_chance_to_compete_in_the_winter/,,,False,v.redd.it
1qxyyfi,"Mariah Carey's prompter for her Italian rendition of ""Volare"" at the Winter Olympics Opening Ceremony",mcfw31,popculturechat,789,0.97,210,1770424082.0,2026-02-07 00:28:02,https://v.redd.it/vwv5q3bjvyhg1,https://www.reddit.com/r/popculturechat/comments/1qxyyfi/mariah_careys_prompter_for_her_italian_rendition/,,Mariah 🦋,False,v.redd.it
1r2pdhl,Ukraine's Heraskevych disqualified from Winter Olympics over 'helmet of remembrance',HydrolicKrane,sports,1381,0.94,113,1770889912.0,2026-02-12 09:51:52,https://www.reuters.com/sports/skeleton-ukraines-heraskevych-disqualified-over-helmet-controversy-2026-02-12/,https://www.reddit.com/r/sports/comments/1r2pdhl/ukraines_heraskevych_disqualified_from_winter/,,:skeleton: Skeleton,False,reuters.com
1r1cyk4,Got a link to a short meeting with HR to discuss an “inappropriate comment” I made about the Winter Olympics,SWEMW,antiwork,897,0.82,176,1770757062.0,2026-02-10 20:57:42,https://www.reddit.com/r/antiwork/comments/1r1cyk4/got_a_link_to_a_short_meeting_with_hr_to_discuss/,https://www.reddit.com/r/antiwork/comments/1r1cyk4/got_a_link_to_a_short_meeting_with_hr_to_discuss/,"All I said was that I was upset about not seeing Russia compete in the Winter Olympics because they’re good at winter sports. (I’m Russian)

EDIT: had the meeting at the end of the day. The meeting was like 8 minutes long and even the HR person was so confused. They just told me to “be careful and mindful when talking about things”. The person who reported me was just an airhead. Complete waste of time and unnecessary.",,True,self.antiwork
1qweoue,Winter Olympics begin quietly with curling,Movie-Kino,sports,1264,0.97,127,1770275812.0,2026-02-05 07:16:52,https://www.dw.com/en/winter-olympics-begin-quietly-with-curling/a-75811934,https://www.reddit.com/r/sports/comments/1qweoue/winter_olympics_begin_quietly_with_curling/,,:winter: Winter Sports,False,dw.com
1r4ma5u,First Ever Winter Olympics Gold Medal in Latin America,ChesterCopperPot72,ItHadToBeBrazil,2474,0.98,64,1771080042.0,2026-02-14 14:40:42,https://i.redd.it/z76ql1g42hjg1.png,https://www.reddit.com/r/ItHadToBeBrazil/comments/1r4ma5u/first_ever_winter_olympics_gold_medal_in_latin/,,,False,i.redd.it
1qpnvee,MEPs urge EU to block ICE from entering Europe for Winter Olympics,MiSbyPiS,europe,1733,0.98,96,1769634082.0,2026-01-28 21:01:22,https://www.euronews.com/my-europe/2026/01/28/meps-urge-eu-to-block-ice-from-entering-europe-for-winter-olympics,https://www.reddit.com/r/europe/comments/1qpnvee/meps_urge_eu_to_block_ice_from_entering_europe/,,News,False,euronews.com
